<?xml version="1.0" encoding="UTF-8"?>
<!--
To change this template, choose Tools | Templates
and open the template in the editor.
-->


<employments
    xmlns:xsi='http://www.w3.org/2001/XMLSchema-instance'
    xmlns='http://www.employmentSchema.com'
    xsi:schemaLocation='http://www.employmentSchema.com employmentOfficeSchema.xsd'>
    <person>
        <ssn>123456789</ssn>
        
        <workExperiences>
            <workExperience>
                <companyCode>12345</companyCode>
                <companyName>KTH</companyName>
                <fromDate>2006-09-25</fromDate>
                <upToDate>2007-09-25</upToDate>
            </workExperience>
            
            <workExperience>
                <companyCode>54321</companyCode>
                <companyName>Ericsson</companyName>
                <fromDate>2008-09-25</fromDate>
                <upToDate>2009-09-25</upToDate>
            </workExperience>
        </workExperiences>
    </person>
    
    
    <person>
        <ssn>987654321</ssn>
        
        <workExperiences>
            <workExperience>
                <companyCode>12345</companyCode>
                <companyName>KTH</companyName>
                <fromDate>2006-09-25</fromDate>
                <upToDate>2007-09-25</upToDate>
            </workExperience>
            
            <workExperience>
                <companyCode>54321</companyCode>
                <companyName>Ericsson</companyName>
                <fromDate>2008-09-25</fromDate>
                <upToDate>2009-09-25</upToDate>
            </workExperience>
        </workExperiences>
    </person>
    

</employments>
